{
  "schemaVersion": 1,
  "packageId": "E2E-PKG-001",
  "familyApi": {
    "id": "artifact.e2e-test-family",
    "major": 1,
    "revisionDigest": "sha256:aaaaaaaaaaaaaaaaaaaaaaaaaaaaaaaaaaaaaaaaaaaaaaaaaaaaaaaaaaaaaaaa"
  },
  "subject": {
    "ref": "e2e/test-01.json",
    "artifactId": "MATRIX-001:FILE",
    "contract": "artifact.e2e-test@1",
    "contractRevisionDigest": "sha256:bbbbbbbbbbbbbbbbbbbbbbbbbbbbbbbbbbbbbbbbbbbbbbbbbbbbbbbbbbbbbbbb",
    "mediaType": "application/json",
    "contentDigest": "sha256:ed4adf0279ce94155727756217a6e5fcaa55e0957342f092d7bbc351111cac8d"
  },
  "members": [
    {
      "role": "eight-dimensional-matrix",
      "ref": "e2e/test-01.matrix.json",
      "memberId": "MATRIX-001",
      "protocol": "e2e-test/matrix",
      "version": "1",
      "mediaType": "application/json",
      "contentDigest": "sha256:33139984719a5eca00d67b6b3cdaa107a6469f11f29afde0578955abdbbebea8"
    }
  ],
  "stageChainDigest": "sha256:cccccccccccccccccccccccccccccccccccccccccccccccccccccccccccccccc",
  "packageDigest": "sha256:f7b4d45111d21578cfecdce1587487f81d0d7ea8d300f427207d38a57a7e7ec2"
}
